{"$comment":"Runtime validators additionally enforce stable-ID equality, uniqueness, timestamps, exact prefecture/fuel coverage, hash/source consistency, bbox/cell membership and source approval.","$id":"https://fuel-me-japan.com/data/schemas/data-manifest.schema.json","$schema":"https://json-schema.org/draft/2020-12/schema","additionalProperties":false,"properties":{"milestone":{"const":"M0.1"},"prices":{"additionalProperties":false,"properties":{"basis":{"const":"CASH_TAX_INCLUDED_PREFECTURAL_REFERENCE"},"bytes":{"minimum":1,"type":"integer"},"count":{"const":141},"inputSha256":{"pattern":"^[a-f0-9]{64}$","type":"string"},"path":{"pattern":"^/data/[A-Za-z0-9_/-]+(?:\\.[A-Za-z0-9_-]+)?\\.json$","type":"string"},"publishedAt":{"format":"date","type":"string"},"sha256":{"pattern":"^[a-f0-9]{64}$","type":"string"},"sourceIds":{"const":["meti-prices"]},"surveyDate":{"format":"date","type":"string"},"transformationVersion":{"minLength":1,"type":"string"},"unit":{"const":"JPY/L"}},"required":["path","sha256","bytes","transformationVersion","inputSha256","sourceIds","count","surveyDate","publishedAt","unit","basis"],"type":"object"},"schemaVersion":{"const":1},"sourceRegistry":{"additionalProperties":false,"properties":{"bytes":{"minimum":1,"type":"integer"},"path":{"pattern":"^/data/[A-Za-z0-9_/-]+(?:\\.[A-Za-z0-9_-]+)?\\.json$","type":"string"},"sha256":{"pattern":"^[a-f0-9]{64}$","type":"string"}},"required":["path","sha256","bytes"],"type":"object"},"sources":{"items":{"additionalProperties":false,"properties":{"fetchedAt":{"format":"date-time","type":"string"},"inputSha256":{"pattern":"^[a-f0-9]{64}$","type":"string"},"sourceId":{"enum":["osm","geofabrik","meti-prices"]},"sourceUpdatedAt":{"anyOf":[{"format":"date","type":"string"},{"format":"date-time","type":"string"}]},"sourceUrl":{"format":"uri","pattern":"^https://","type":"string"},"transformationVersion":{"minLength":1,"type":"string"}},"required":["sourceId","sourceUrl","inputSha256","fetchedAt","sourceUpdatedAt","transformationVersion"],"type":"object"},"maxItems":3,"minItems":3,"type":"array"},"stations":{"additionalProperties":false,"properties":{"audit":{"additionalProperties":false,"properties":{"bytes":{"minimum":1,"type":"integer"},"path":{"pattern":"^/data/[A-Za-z0-9_/-]+(?:\\.[A-Za-z0-9_-]+)?\\.json$","type":"string"},"sha256":{"pattern":"^[a-f0-9]{64}$","type":"string"}},"required":["path","sha256","bytes"],"type":"object"},"count":{"minimum":1,"type":"integer"},"coverage":{"minLength":1,"type":"string"},"inputSha256":{"pattern":"^[a-f0-9]{64}$","type":"string"},"license":{"const":"ODbL-1.0"},"licenseUrl":{"const":"https://opendatacommons.org/licenses/odbl/1-0/"},"noticeUrl":{"const":"/data/OSM-NOTICE.txt"},"partitions":{"items":{"additionalProperties":false,"properties":{"bbox":{"anyOf":[{"maxItems":4,"minItems":4,"prefixItems":[{"maximum":155,"minimum":122,"type":"number"},{"maximum":46,"minimum":20,"type":"number"},{"maximum":155,"minimum":122,"type":"number"},{"maximum":46,"minimum":20,"type":"number"}],"type":"array"},{"type":"null"}]},"bytes":{"minimum":1,"type":"integer"},"cells":{"items":{"maxItems":4,"minItems":4,"prefixItems":[{"maximum":155,"minimum":122,"type":"number"},{"maximum":46,"minimum":20,"type":"number"},{"maximum":155,"minimum":122,"type":"number"},{"maximum":46,"minimum":20,"type":"number"}],"type":"array"},"type":"array"},"code":{"enum":["JP-01","JP-02","JP-03","JP-04","JP-05","JP-06","JP-07","JP-08","JP-09","JP-10","JP-11","JP-12","JP-13","JP-14","JP-15","JP-16","JP-17","JP-18","JP-19","JP-20","JP-21","JP-22","JP-23","JP-24","JP-25","JP-26","JP-27","JP-28","JP-29","JP-30","JP-31","JP-32","JP-33","JP-34","JP-35","JP-36","JP-37","JP-38","JP-39","JP-40","JP-41","JP-42","JP-43","JP-44","JP-45","JP-46","JP-47","UNKNOWN"]},"count":{"minimum":0,"type":"integer"},"path":{"pattern":"^/data/[A-Za-z0-9_/-]+(?:\\.[A-Za-z0-9_-]+)?\\.json$","type":"string"},"sha256":{"pattern":"^[a-f0-9]{64}$","type":"string"}},"required":["path","sha256","bytes","code","count","bbox","cells"],"type":"object"},"maxItems":48,"minItems":48,"type":"array"},"sourceIds":{"const":["osm","geofabrik"]},"sourceUpdatedAt":{"format":"date-time","type":"string"},"transformationVersion":{"minLength":1,"type":"string"},"version":{"minLength":1,"type":"string"}},"required":["version","transformationVersion","inputSha256","sourceIds","sourceUpdatedAt","count","partitions","audit","license","licenseUrl","noticeUrl","coverage"],"type":"object"},"transformationVersion":{"minLength":1,"type":"string"}},"required":["schemaVersion","milestone","transformationVersion","sourceRegistry","sources","stations","prices"],"title":"Fuel Me Japan M0.1 data-manifest","type":"object"}
