{"milestone":"M0.1","prices":{"basis":"CASH_TAX_INCLUDED_PREFECTURAL_REFERENCE","bytes":37502,"count":141,"inputSha256":"909d32f785bc09ab418b35dd5288e2536bb3f615240c4a4e06204b78de76a175","path":"/data/prices/archive/2026-09-30-febb0ebdd7d0.json","publishedAt":"2026-09-30","sha256":"febb0ebdd7d0a15903c5726747dce6dd1427a0ecc2e53002d0d30cb654a7111b","sourceIds":["meti-prices"],"surveyDate":"2026-09-28","transformationVersion":"m01-data-v2","unit":"JPY/L"},"schemaVersion":1,"sourceRegistry":{"bytes":5783,"path":"/data/registry/3ad895fc107a0ce9.json","sha256":"3ad895fc107a0ce94271817df97de8f6de23c43e8a222b1a594a37a5f6459a5b"},"sources":[{"fetchedAt":"2026-09-30T08:07:46.820150+00:00","inputSha256":"c083bcad49fa77462f8f3c5cb5f4fda5f346f6f69f45075c61b71b4ac199ecdd","sourceId":"geofabrik","sourceUpdatedAt":"2026-09-29T20:22:51Z","sourceUrl":"https://download.geofabrik.de/asia/japan-260929.osm.pbf","transformationVersion":"m01-data-v2"},{"fetchedAt":"2026-09-30T08:17:27.371596+00:00","inputSha256":"909d32f785bc09ab418b35dd5288e2536bb3f615240c4a4e06204b78de76a175","sourceId":"meti-prices","sourceUpdatedAt":"2026-09-30","sourceUrl":"https://www.enecho.meti.go.jp/statistics/petroleum_and_lpgas/pl007/xlsx/260930.xlsx","transformationVersion":"m01-data-v2"},{"fetchedAt":"2026-09-30T08:07:46.820150+00:00","inputSha256":"c083bcad49fa77462f8f3c5cb5f4fda5f346f6f69f45075c61b71b4ac199ecdd","sourceId":"osm","sourceUpdatedAt":"2026-09-29T20:22:51Z","sourceUrl":"https://download.geofabrik.de/asia/japan-260929.osm.pbf","transformationVersion":"m01-data-v2"}],"stations":{"audit":{"bytes":706,"path":"/data/stations/2026-09-29-c083bcad49fa-m01-data-v2/audit.json","sha256":"eb8dd2e3277b8787eafb61eb02443bb2f5be6801255136c0ad737487f1f2c703"},"count":16454,"coverage":"Partial OpenStreetMap coverage; not a complete inventory of businesses","inputSha256":"c083bcad49fa77462f8f3c5cb5f4fda5f346f6f69f45075c61b71b4ac199ecdd","license":"ODbL-1.0","licenseUrl":"https://opendatacommons.org/licenses/odbl/1-0/","noticeUrl":"/data/OSM-NOTICE.txt","partitions":[{"bbox":[139.5161014,41.4248554,145.5868078,45.4640415],"bytes":518304,"cells":[[139.5,41.5,140.0,42.0],[139.5,42.0,140.0,42.5],[140.0,41.0,140.5,41.5],[140.0,41.5,140.5,42.0],[140.0,42.0,140.5,42.5],[140.0,42.5,140.5,43.0],[140.0,43.0,140.5,43.5],[140.5,41.5,141.0,42.0],[140.5,42.0,141.0,42.5],[140.5,42.5,141.0,43.0],[140.5,43.0,141.0,43.5],[141.0,41.5,141.5,42.0],[141.0,42.0,141.5,42.5],[141.0,42.5,141.5,43.0],[141.0,43.0,141.5,43.5],[141.0,45.0,141.5,45.5],[141.5,42.5,142.0,43.0],[141.5,43.0,142.0,43.5],[141.5,43.5,142.0,44.0],[141.5,44.0,142.0,44.5],[141.5,44.5,142.0,45.0],[141.5,45.0,142.0,45.5],[142.0,42.0,142.5,42.5],[142.0,42.5,142.5,43.0],[142.0,43.0,142.5,43.5],[142.0,43.5,142.5,44.0],[142.0,44.0,142.5,44.5],[142.0,44.5,142.5,45.0],[142.0,45.0,142.5,45.5],[142.5,42.0,143.0,42.5],[142.5,42.5,143.0,43.0],[142.5,43.0,143.0,43.5],[142.5,43.5,143.0,44.0],[142.5,44.0,143.0,44.5],[142.5,44.5,143.0,45.0],[143.0,42.0,143.5,42.5],[143.0,42.5,143.5,43.0],[143.0,43.0,143.5,43.5],[143.0,43.5,143.5,44.0],[143.0,44.0,143.5,44.5],[143.5,42.5,144.0,43.0],[143.5,43.0,144.0,43.5],[143.5,43.5,144.0,44.0],[143.5,44.0,144.0,44.5],[144.0,42.5,144.5,43.0],[144.0,43.0,144.5,43.5],[144.0,43.5,144.5,44.0],[144.0,44.0,144.5,44.5],[144.5,43.0,145.0,43.5],[144.5,43.5,145.0,44.0],[144.5,44.0,145.0,44.5],[145.0,43.0,145.5,43.5],[145.0,43.5,145.5,44.0],[145.0,44.0,145.5,44.5],[145.5,43.0,146.0,43.5]],"code":"JP-01","count":1148,"path":"/data/stations/2026-09-29-c083bcad49fa-m01-data-v2/JP-01.json","sha256":"69201e1a2f3a41766d14ada3d34f704cd023d80b6509ebff607d8768b79a8add"},{"bbox":[139.9152017,40.38937,141.6614454,41.53518],"bytes":134059,"cells":[[139.5,40.5,140.0,41.0],[140.0,40.5,140.5,41.0],[140.0,41.0,140.5,41.5],[140.5,40.5,141.0,41.0],[140.5,41.0,141.0,41.5],[140.5,41.5,141.0,42.0],[141.0,40.0,141.5,40.5],[141.0,40.5,141.5,41.0],[141.0,41.0,141.5,41.5],[141.5,40.0,142.0,40.5],[141.5,40.5,142.0,41.0]],"code":"JP-02","count":332,"path":"/data/stations/2026-09-29-c083bcad49fa-m01-data-v2/JP-02.json","sha256":"a61409f10984a2840bf9e10733607f38a2fdd94de65dea16d606f36dba5ccd9d"},{"bbox":[140.7509413,38.8985439,141.9855015,40.408636],"bytes":78434,"cells":[[140.5,39.0,141.0,39.5],[140.5,39.5,141.0,40.0],[140.5,40.0,141.0,40.5],[141.0,38.5,141.5,39.0],[141.0,39.0,141.5,39.5],[141.0,39.5,141.5,40.0],[141.0,40.0,141.5,40.5],[141.5,39.0,142.0,39.5],[141.5,39.5,142.0,40.0],[141.5,40.0,142.0,40.5]],"code":"JP-03","count":185,"path":"/data/stations/2026-09-29-c083bcad49fa-m01-data-v2/JP-03.json","sha256":"5d142612f790072fc056febb23447787ab509bac6e35d72f6e4e49515a14e048"},{"bbox":[140.4390253,37.8292672,141.6491429,38.9318694],"bytes":265769,"cells":[[140.0,37.5,140.5,38.0],[140.5,37.5,141.0,38.0],[140.5,38.0,141.0,38.5],[140.5,38.5,141.0,39.0],[141.0,38.0,141.5,38.5],[141.0,38.5,141.5,39.0],[141.5,38.0,142.0,38.5],[141.5,38.5,142.0,39.0]],"code":"JP-04","count":623,"path":"/data/stations/2026-09-29-c083bcad49fa-m01-data-v2/JP-04.json","sha256":"8c3590289fef6bdcab94d67f10d69d8c9d0f13a3c9309ef9f3bd59d44031b205"},{"bbox":[139.7634647,39.0068105,140.8944346,40.4239726],"bytes":135209,"cells":[[139.5,39.0,140.0,39.5],[139.5,39.5,140.0,40.0],[140.0,39.0,140.5,39.5],[140.0,39.5,140.5,40.0],[140.0,40.0,140.5,40.5],[140.5,39.0,141.0,39.5],[140.5,39.5,141.0,40.0],[140.5,40.0,141.0,40.5]],"code":"JP-05","count":326,"path":"/data/stations/2026-09-29-c083bcad49fa-m01-data-v2/JP-05.json","sha256":"a2b98aefa932f222b6469d3f8c405f454ba5a429a6e6cd6dc0ea41b49a541601"},{"bbox":[139.5496084,37.8868612,140.5517999,39.0592853],"bytes":143109,"cells":[[139.5,37.5,140.0,38.0],[139.5,38.0,140.0,38.5],[139.5,38.5,140.0,39.0],[139.5,39.0,140.0,39.5],[140.0,37.5,140.5,38.0],[140.0,38.0,140.5,38.5],[140.0,38.5,140.5,39.0],[140.5,38.5,141.0,39.0]],"code":"JP-06","count":356,"path":"/data/stations/2026-09-29-c083bcad49fa-m01-data-v2/JP-06.json","sha256":"68803d3c4c50a657ef7c67188c9ffaf50c6298d027808c364c4ded7b05cec4f2"},{"bbox":[139.3172689,36.8858032,141.0146086,37.9084682],"bytes":132898,"cells":[[139.0,37.0,139.5,37.5],[139.5,37.0,140.0,37.5],[139.5,37.5,140.0,38.0],[140.0,37.0,140.5,37.5],[140.0,37.5,140.5,38.0],[140.5,36.5,141.0,37.0],[140.5,37.0,141.0,37.5],[140.5,37.5,141.0,38.0],[141.0,37.0,141.5,37.5],[141.0,37.5,141.5,38.0]],"code":"JP-07","count":322,"path":"/data/stations/2026-09-29-c083bcad49fa-m01-data-v2/JP-07.json","sha256":"2ab90e6c587472be1e9e6f1af843fbf425b8f3ba3d3e40faefae6fa6f376f00d"},{"bbox":[139.7022332,35.752284,140.8164797,36.8378767],"bytes":143121,"cells":[[139.5,35.5,140.0,36.0],[139.5,36.0,140.0,36.5],[140.0,35.5,140.5,36.0],[140.0,36.0,140.5,36.5],[140.0,36.5,140.5,37.0],[140.5,35.5,141.0,36.0],[140.5,36.0,141.0,36.5],[140.5,36.5,141.0,37.0]],"code":"JP-08","count":347,"path":"/data/stations/2026-09-29-c083bcad49fa-m01-data-v2/JP-08.json","sha256":"685db8bbd907136cc45e11ee5fc3f8d22260a3f55463d9fa8fe62c4ea2d7de45"},{"bbox":[139.371759,36.2204086,140.2177044,37.1113885],"bytes":110707,"cells":[[139.0,36.0,139.5,36.5],[139.0,36.5,139.5,37.0],[139.5,36.0,140.0,36.5],[139.5,36.5,140.0,37.0],[139.5,37.0,140.0,37.5],[140.0,36.0,140.5,36.5],[140.0,36.5,140.5,37.0],[140.0,37.0,140.5,37.5]],"code":"JP-09","count":278,"path":"/data/stations/2026-09-29-c083bcad49fa-m01-data-v2/JP-09.json","sha256":"7b6a2422fb4b62e54d29fe2961567b159e5f35c8b38affafa417a1147998977d"},{"bbox":[138.498954,36.0806801,139.5715668,36.7633156],"bytes":143301,"cells":[[138.0,36.5,138.5,37.0],[138.5,36.0,139.0,36.5],[138.5,36.5,139.0,37.0],[139.0,36.0,139.5,36.5],[139.0,36.5,139.5,37.0],[139.5,36.0,140.0,36.5]],"code":"JP-10","count":347,"path":"/data/stations/2026-09-29-c083bcad49fa-m01-data-v2/JP-10.json","sha256":"6ed188eac5bfc5957baab99ac21c78c7cd04bbd2131a676d3f33889f864cd2c6"},{"bbox":[139.0095136,35.7603441,139.8870614,36.2613213],"bytes":285724,"cells":[[139.0,35.5,139.5,36.0],[139.0,36.0,139.5,36.5],[139.5,35.5,140.0,36.0],[139.5,36.0,140.0,36.5]],"code":"JP-11","count":667,"path":"/data/stations/2026-09-29-c083bcad49fa-m01-data-v2/JP-11.json","sha256":"177be48b2cd8e5dbc7f6b347524e9add67d95c5ae9b605e9156a89467b78b08e"},{"bbox":[139.788547,34.9117482,140.8599347,36.0932051],"bytes":309245,"cells":[[139.5,34.5,140.0,35.0],[139.5,35.0,140.0,35.5],[139.5,35.5,140.0,36.0],[139.5,36.0,140.0,36.5],[140.0,35.0,140.5,35.5],[140.0,35.5,140.5,36.0],[140.5,35.5,141.0,36.0]],"code":"JP-12","count":726,"path":"/data/stations/2026-09-29-c083bcad49fa-m01-data-v2/JP-12.json","sha256":"a9d046a2c80200282b7175ce59fbb065e42ffd446929ef9e4e366858024dafc8"},{"bbox":[139.0977071,27.0928749,142.1913325,35.8334528],"bytes":363375,"cells":[[139.0,34.0,139.5,34.5],[139.0,34.5,139.5,35.0],[139.0,35.5,139.5,36.0],[139.5,32.0,140.0,32.5],[139.5,33.0,140.0,33.5],[139.5,34.0,140.0,34.5],[139.5,35.5,140.0,36.0],[142.0,27.0,142.5,27.5]],"code":"JP-13","count":818,"path":"/data/stations/2026-09-29-c083bcad49fa-m01-data-v2/JP-13.json","sha256":"39c94b0723096fc817be99e1e18be5286dd224948f54b1212c679fcf064b6aa5"},{"bbox":[139.015978,35.1409363,139.7861847,35.6269647],"bytes":363760,"cells":[[139.0,35.0,139.5,35.5],[139.0,35.5,139.5,36.0],[139.5,35.0,140.0,35.5],[139.5,35.5,140.0,36.0]],"code":"JP-14","count":839,"path":"/data/stations/2026-09-29-c083bcad49fa-m01-data-v2/JP-14.json","sha256":"009a691cb662405ee9a87a53930c80898577749dea2614a3b3b1d8cfdebe081d"},{"bbox":[137.8179714,36.786871,139.6827847,38.5437112],"bytes":126269,"cells":[[137.5,36.5,138.0,37.0],[137.5,37.0,138.0,37.5],[138.0,36.5,138.5,37.0],[138.0,37.0,138.5,37.5],[138.0,37.5,138.5,38.0],[138.0,38.0,138.5,38.5],[138.5,36.5,139.0,37.0],[138.5,37.0,139.0,37.5],[138.5,37.5,139.0,38.0],[138.5,38.0,139.0,38.5],[139.0,37.0,139.5,37.5],[139.0,37.5,139.5,38.0],[139.0,38.0,139.5,38.5],[139.5,38.0,140.0,38.5],[139.5,38.5,140.0,39.0]],"code":"JP-15","count":313,"path":"/data/stations/2026-09-29-c083bcad49fa-m01-data-v2/JP-15.json","sha256":"9aac868febdbc8d4c78263c45a7577743fa2ab2a85a1f9919a1b523bfbca1821"},{"bbox":[136.8719929,36.452896,137.563